;;;;;;;;;;;;;x,,,,,
MAJORITY_IS_NOT;Majority of the population is not ;;;;;;;;;;;;x,,,,,
EVTNAME11100_NEW;The Unification of $CULTURE_GROUP_UNION$;;;;;;;;;;;;x,,,,,
EVTDESC11100_NEW;A rising tide of liberal nationalism within $CULTURE_GROUP_UNION$ has begun to spread, raising the idea of a $UNION_ADJ$ union with $COUNTRY$ at its head. A parliament of liberal revolutionaries has been convened, with representatives from throughout $UNION_ADJ$ lands, which has decreed the time is right for the nation to unite under one banner. The parliament has offered the crown of $CULTURE_GROUP_UNION$ to us. We could accept the offer, but doing so would cause international alarm, and require us to compensate the revolutionaries politically.;;;;;;;;;;;;x
EVTNAME11104;The North German Federation;;;;;;;;;;;;x,,,,,
EVTDESC11104;A rising tide of liberal nationalism within northern Germany has begun to spread, raising the idea of a federation with $COUNTRY$ as its leader. A parliament of liberal revolutionaries has been convened, which has decreed the time is right for the northern German states to unite under one banner. The parliament has offered the crown of this North German Federation to us. We could accept the offer,but doing so would cause international alarm, and require us to compensate the revolutionaries politically.;;;;;;;;;;;;x,
EVTNAME11105;The South German Federation;;;;;;;;;;;;x,,,,,
EVTDESC11105;A rising tide of liberal nationalism within southern Germany has begun to spread, raising the idea of a federation with $COUNTRY$ as its leader. A parliament of liberal revolutionaries has been convened, which has decreed the time is right for the southern German states to unite under one banner. The parliament has offered the crown of this South German Federation to us. We could accept the offer,but doing so would cause international alarm, and require us to compensate the revolutionaries politically.;;;;;;;;;;;;x,
EVTNAME11106;The $FROMCOUNTRY_ADJ$ Proposal;;;;;;;;;;;;x,,,,,
EVTDESC11106;$MONARCHTITLE$, the $FROMCOUNTRY_ADJ$ ambassador has presented us with news from the recent parliament of German revolutionaries. $FROMCOUNTRY$ has agreed to assemble a federation of German states, with the goal of eventually forming a greater Germany. If we do not agree,it is possible that $FROMCOUNTRY$ will attempt to take our lands by force.;;;;;;;;;;;;x,,
EVTNAME36215_NEW;Home Rule for Iceland;;;;;;;;;;;;x,,,,,
EVTDESC36215_NEW;The Icelandic Althing has voted to request they be granted home rule, saying the time has come for greater independence. Under their plan, $COUNTRY$ would continue to manage the nation's foreign affairs and defense interests.;;;;;;;;;;;;x,,,
EVTNAME45102;La Trinitaria;;;;;;;;;;;;x,,,,,
EVTDESC45102;Juan Pablo Duarte has founded a secret society called 'La Trinitaria', seeking complete independence of Santo Domingo from Haiti and other foreign powers. Many Caribenos are calling the man a visionary, and his ideas are gaining great popularity in eastern Hispaniola.;;;;;;;;;;;;x,,,
EVTNAME46303;War of the Farrapos;;;;;;;;;;;;x,,,,,
EVTDESC36215_NEW;Porto Alegre is under Brazilian control once again. The gauchos, however, have promised to continue their rebellion against what they consider unfair rule from the throne. It may prove difficult in the coming years to keep the region calm.;;;;;;;;;;;;x,,,
EVTNAME60121;Joining the Greater Union;;;;;;;;;;;;x,,,,,
EVTDESC60121;Since the revolution, the $COUNTRY_ADJ$ government has awaited a contender who could unite $CULTURE_GROUP_UNION$. Now that such a nation has arisen, many feel it is time to surrender our personal sovereignty towards the $UNION_ADJ$ cause.;;;;;;;;;;;;x,,,
EVTNAME90038;The Pact of Plombières;;;;;;;;;;;;x,,,,,
EVTDESC90038;We have been approached by a Sardinian envoy, the Count of Cavour, who has made an interesting proposal: an alliance to make war against Austria, gaining Sardinia the Austrian-held provinces of Lombardy. In exchange, Sardinia would hand over Savoy and Nice to France. It is an interesting idea, and one that allows France to take a role that would not paint us as the aggressors. Shall we agree?;;;;;;;;;;;;x
EVTNAME90040;The Sepoy Rebellion;;;;;;;;;;;;x,,,,,
EVTDESC90040;A mutiny by a group of sepoys in the service of the British East India company has ignited lingering resentment amongst our Indian subjects into open resistance against our rule. Should this grow out of hand, all of our holdings in British India could be in jeopardy.;;;;;;;;;;;;x,,,,
EVTDESC90039;$MONARCHTITLE$, the ambassador from Sardinia-Piedmont has approached us with the suggestion of a pan-Italian alliance to retake the lost northern lands from Austria. A dangerous proposition, to be sure.;;;;;;;;;;;;x,,,
EVTNAME90041;Galician Slaughter;;;;;;;;;;;;x,,,,,
EVTDESC90041;Polish peasants in Austrian-held Galicia have risen up and slaughtered wealthy landowners, leading to calls by nobility within the Free City of Krakow for a larger uprising. Many in Austria are seeing this as a reason to end Krakow's independence once and for all.;;;;;;;;;;;;x,,,,
EVTNAME95026;Liberian Independence;;;;;;;;;;;;;x,,,,,
EVTDESC95026;The Liberian colony was founded as a homeland for freed American slaves by the American Colonization Society. Now that Liberia is considered a financial drain on its resources, the ACS is urging Liberia to proclaim idependence and find its own destiny.;;;;;;;;;;;;;x,,,,
EVTNAME95076;The $MONTH$ Uprising;;;;;;;;;;;;x,,,,,
EVTDESC95076;A spontaneous protest by young Poles against conscription into the Russian Army has quickly erupted into a widespread insurrection, supported by high-ranking Polish and Lithuanian officers and politicians. The eyes of all of Europe are upon us, and if we deal with the insurgents too harshly it may hurt our relations with European powers. If we do not, however, the uprising may spread even further.;;;;;;;;;;;;x,
EVTNAME95085;The Finnish Question;;;;;;;;;;;;x,,,,,
EVTDESC95085;With the recent unrest in Finnish lands, the local Finland government has demanded greater autonomy from $COUNTRY_ADJ$ rule. Failure to provide it will only lead to further ethnic unrest.;;;;;;;;;;;;x,,,,
EVTNAME95095;Norwegian Independence;;;;;;;;;;;;x,,,,,
EVTDESC95095;The Norwegian government has formally requested to be granted full independence from $COUNTRY_ADJ$ rule.;;;;;;;;;;;;x,,,,,
EVTNAME95200;Turkmen Nationalism;;;;;;;;;;;;x,,,,,
EVTDESC95200;A wave of nascent nationalism has begun stirring among the Turkmen peoples under $COUNTRY_ADJ$ rulership. While the notion of a Turkmenian state is still a new concept, the possibility exists for it to spread and even lead to full rebellion in time. We must watch this carefully.;;;;;;;;;;;;x,,,,
EVTNAME95205;Uzbek Nationalism;;;;;;;;;;;;x,,,,,
EVTDESC95205;A wave of nascent nationalism has begun stirring among the Uzbek peoples under $COUNTRY_ADJ$ rulership. While the notion of a single Uzbek state is still a new concept, the possibility exists for it to spread and even lead to full rebellion in time. We must watch this carefully.;;;;;;;;;;;;x,,,,
EVTNAME95206;Reclaiming Uzbek Lands;;;;;;;;;;;;x,,,,,
EVTDESC95206;The $COUNTRY_ADJ$ people are clamoring for all Uzebeks to be united under our flag.;;;;;;;;;;;;x,,,,,
EVTNAME95210;Tajik Nationalism;;;;;;;;;;;;x,,,,,
EVTDESC95210;A wave of nascent nationalism has begun stirring among the Tajik peoples under $COUNTRY_ADJ$ rulership. While the notion of a Tajik state is still a new concept, the possibility exists for it to spread and even lead to full rebellion in time. We must watch this carefully.;;;;;;;;;;;;x,,,,
EVTNAME95215;Kyrgyz Nationalism;;;;;;;;;;;;x,,,,,
EVTDESC95215;A wave of nascent nationalism has begun stirring among the Kyrgyz peoples under $COUNTRY_ADJ$ rulership. While the notion of a modern Kyrgyz state is still a new concept, the possibility exists for it to spread and even lead to full rebellion in time. We must watch this carefully.;;;;;;;;;;;;x,,,,
EVTNAME95216;Reclaiming Kyrgyz Lands;;;;;;;;;;;;x,,,,,
EVTDESC95216;The $COUNTRY_ADJ$ people are clamoring for all Kyrgyz to be united under our flag.;;;;;;;;;;;;x,,,,,
EVTNAME95250;The White Rajah;;;;;;;;;;;;x,,,,,
EVTDESC95250;Brunei's control over the southern regions has only ever been nominal, and the region has been self-governed under the Sultan of Sarawak. During a recent crisis, an Englishman by the name of James Brooke provided the Sultan invaluable assistance in restoring order, and has been bestowed with the title of governor. This 'White Rajah' is now effectively the ruler, and is seeking alliance with Brunei. We must either recognize the independence of an area we only barely controlled, or seek to assert our authority and perhaps anger the English in the process.;;;;;;;;;;;;x
EVTNAME95251;The Dutch East Indies;;;;;;;;;;;;x,,,,,
EVTDESC95251;The Dutch East India Company has been slowly spreading its influence within the East Indies, and is urging our government to establish protectorates over the remaining sultanates on the islands. Indeed, they have been stirring up trouble in the region. Many within our government feel that if the Netherlands is to remain a power to be reckoned with, it must expand its colonial holdings.;;;;;;;;;;;;x,,
EVTNAME96100;The Arab Revolt;;;;;;;;;;;;x,,,,,
EVTDESC96100;A wave of nationalism has begun to spread among the Mashriqi, fueled by their resentment over $COUNTRY_ADJ$ rule. Our governors in the region are understandably nervous, and report that we can expect major rebellions in the coming years unless we are very careful.;;;;;;;;;;;;x,,,
EVTNAME96101;$COUNTRY_ADJ$ Self-Rule;;;;;;;;;;;;x,,,,,
EVTDESC96101;We have been granted self-rule by our $FROMCOUNTRY_ADJ$ rulers.;;;;;;;;;;;;x,,,,,
EVTDESC96102;The Arab Revolt has begun, and many people in $CAPITAL$ are flying the revolt flag. They are demanding freedom from foreigner rule, and we will have difficulty keeping them under control... provided that's what we wish to do, of course.;;;;;;;;;;;;x,,
EVTNAME96105;The Bedouin Revolt;;;;;;;;;;;;x,,,,,
EVTDESC96105;A wave of nationalism has begun to spread among the Bedouin, fueled by their resentment over $COUNTRY_ADJ$ rule. Our governors in the region are understandably nervous, and report that we can expect major rebellions in the coming years unless we are very careful.;;;;;;;;;;;;x,,,
EVTNAME96110;The House of Saud Returns;;;;;;;;;;;;x,,,,,
EVTDESC96110;Abdul-Aziz, scion of the House of Saud, has returned from exile in Kuwait. Not only that, the man has managed to forge an alliance with the southern Bedouin tribes and retaken Riyadh. We must deal with ibn Saud quickly, lest he retake even more land and reverse our earlier victory over his house.;;;;;;;;;;;;x,
EVTNAME96115;The Rule of Hedjaz;;;;;;;;;;;;x,,,,,
EVTDESC96115;We have always been torn between our loyalty to Egypt and to the Ottoman Empire. The time has come to decide between them.;;;;;;;;;;;;x,,,,,
EVTNAME96120;The House of Rashid;;;;;;;;;;;;x,,,,,
EVTDESC96120;The House of Saud will never unite Arabia so long as the Emirate of Ha'il stands on our northern border. We must marshal our force and bring them to their knees.;;;;;;;;;;;;x,,,,,
EVTNAME96121;The House of Saud;;;;;;;;;;;;x,,,,,
EVTDESC96121;The House of Rashid will never unite Arabia so long as the Emirate of Nejd stands on our southern border. We must marshal our force and bring them to their knees.;;;;;;;;;;;;x,,,,,
EVTNAME96165;Italian Unification;;;;;;;;;;;;x,,,,,
EVTDESC96165;The Italians have managed to unify at long last, threatening $COUNTRY_ADJ$ interests in the region. We will have to decide whether it is in our best interests to object or to make friends with the new rulers. What has been done cannot now be undone, after all, and a united Italy could be a formidable enemy or a powerful $COUNTRY_ADJ$ ally.;;;;;;;;;;;;x,,
EVTNAME96170;Il Risorgimento;;;;;;;;;;;;x,,,,,
EVTDESC96170;$COUNTRY$ has become the center of Italian nationalism, its people calling out for unification. Italian flags are flying in the streets of $CAPITAL$, and we must decide if we wish to support this call and bring all of Italy peacefully under our banner. If we refuse, our people will be upset... and it's unlikely the opportunity will arise again.;;;;;;;;;;;;x,,
EVTNAME160001;The Taiping Rebellion;;;;;;;;;;;;x,,,,,
EVTDESC160001;The followers of the so-called 'Heavenly Kingdom' have finally risen in rebellion against Imperial rule. A peasant army has been organized by the rebels Feng Yunshan and Wei Changhui, followers of Hong Xiuquan, and have actually managed to defeat the Imperial garrisons and drive out the local governors. These Christians are driven to topple the Qing Dynasty and led by a madman... we must act quickly, before this rebellion succeeds and proves to the rest of China that the Mandate of Heaven no longer rests with the Manchu.;;;;;;;;;;;;x,,
EVTNAME160002;Taiping Rebellion Defeated;;;;;;;;;;;;x,,,,,
EVTDESC160002;We have crushed the 'Heavenly Kingdom', and proven to all of China that the Qing Dynasty yet maintains the Mandate of Heaven. We will abide no more insurrections.;;;;;;;;;;;;x,,,,
EVTNAME160003;Taiping Rebellion Victorious;;;;;;;;;;;;x,,,,,
EVTDESC160003;Even though we are not yet done with the 'Heavenly Kingdom', the fact the rebels have forced us to a ceasefire and have not been crushed is being taken by our Chinese subjects as a sign of weakness. Officials are predicting rebellions in many other places in the years to come.;;;;;;;;;;;;x,,,,
EVTNAME160011;The Female Shortage;;;;;;;;;;;;x,,,,,
EVTDESC160011;Due to the low value assigned to the birth of daughters, female infanticide has become wide-spread across much of China. The practice has become so common, in fact, it has led to a shortage of women.;;;;;;;;;;;;x,,
EVTNAME160501;Missionaries in $PROVINCENAME$;;;;;;;;;;;;x,,,,,
EVTDESC160501;Christian missionaries are stirring up trouble in southern China, handing out pamphlets in an effort to gain converts. This would not be so objectionable were the pamphlet not also preaching sedition against the Qing Dynasty. The fact that so many in $PROVINCENAME$ are willing to listen to these fools is worrying.;;;;;;;;;;;;x,,,,
EVTNAME160502;Anti-Manchu Sentiment;;;;;;;;;;;;x,,,,,
EVTDESC160502;To many people in China, the Qing Dynasty is seen as ineffective and corrupt, ruled by Manchu foreigners. Bitter hatred has been stirring, particularly in the south. This is especially true in $PROVINCENAME$, where there are reports of rioting after a recent confrontation between locals and Manchu officials.;;;;;;;;;;;;x,
EVTNAME162503;The Taiping Sect Spreads!;;;;;;;;;;;;x,,,,,
EVTDESC162503;The followers of the so-called 'Heavenly Kingdom' have infested yet another province. According to officials in $PROVINCENAME$, followers of Hong Xiuquan have been spotted and sentiment against the Qing Dynasty is on the rise.;;;;;;;;;;;;x,,,,
EVTNAME164503;The Heavenly Kingdom;;;;;;;;;;;;x,,,,,
EVTDESC164503;A troublemaker has arisen in the southern lands. According to reports, this man claims to have received a vision to the effect that he is the younger brother of Jesus Christ and was sent to rid China of the corrupt Manchu Qing Dynasty rulers. He has been winning converts to Christianity, and it seems there are many willing to listen to his words of sedition and join his so-called 'Heavenly Kingdom'.;;;;;;;;;;;;x,,,
EVTNAME164504;Hong Xiuquan;;;;;;;;;;;;x,,,,,
EVTDESC164504;The man behind the so-called 'Heavenly Kingdom' has been given a name: Hong Xiuquan. A former farmer who attempted the civil service examinations in Guangzhou and failed, he has now become a charismatic visionary taking advantage of anti-Manchu sentiment in the south. Some say he is crazed and mad, but regardless he is a danger to the Qing Dynasty and his words are finding eager ears.;;;;;;;;;;;;x,,,
EVTNAME164505;Yang Xiuqing;;;;;;;;;;;;x,,,,,
EVTDESC164505;Reports have arrived at the palace that a firewood seller has taken to walking the Southlands, claiming to speak with the voice of God. Regardless of his seeming madness, the man has proven very effective at spreading the word of the so-called 'Heavenly Kingdom'.;;;;;;;;;;;;x,,,
EVTNAME800050;The Power of Tradition;;;;;;;;;;;;x,,,,,
EVTDESC800050;Reactionary elements have taken over the $COUNTRY_ADJ$ government, and their influence is felt both here and abroad. Their leadership has already begun to institute widespread changes in the government, while crowds cheer from the central square in $CAPITAL$.;;;;;;;;;;;;x,,,
EVTNAME800051;The New $COUNTRY_ADJ$ Order;;;;;;;;;;;;x,,,,,
EVTDESC800051;Fascist elements have taken over the $COUNTRY_ADJ$ government, and their influence is felt both here and abroad. Their leadership has already begun to institute widespread changes in the government, while crowds cheer from the central square in $CAPITAL$.;;;;;;;;;;;;x,,,
EVTNAME800052;The New Communist Regime;;;;;;;;;;;;x,,,,,
EVTDESC800052;Communists have taken over the $COUNTRY_ADJ$ government, and their influence is felt both here and abroad. Their leadership has already begun to institute widespread changes in the government, while crowds cheer from the central square in $CAPITAL$.;;;;;;;;;;;;x,,,
EVTNAME800053;A New Order in $COUNTRY$;;;;;;;;;;;;x,,,,,
EVTDESC800053;Anarcho-Liberal elements have taken over the $COUNTRY_ADJ$ government, and their influence is felt both here and abroad. Their leadership has already begun to institute widespread changes in the government, while crowds cheer from the central square in $CAPITAL$.;;;;;;;;;;;;x,,,
EVTNAME800054;Democracy Comes to $COUNTRY$!;;;;;;;;;;;;x,,,,,
EVTDESC800054;Cheering crowds in $CAPITAL$ are celebrating the toppling of the old $COUNTRY_ADJ$ government, now replaced by a new and liberal order that has already declared plans for free elections. Even so, they have already begun to institute changes in $COUNTRY$ that are being felt here and abroad.;;;;;;;;;;;;x,,,
EVTNAME800055;Rebellion in $FROMCOUNTRY$!;;;;;;;;;;;;x,,,,,
EVTDESC800055;The $FROMCOUNTRY_ADJ$ goverment has been overthrown, and the rebel government has declared themselves free from $COUNTRY_ADJ$ rule. Many are calling for a restoration of order, while others are saying that $FROMCOUNTRY$ is too much trouble. If they want to be free, let them go.;;;;;;;;;;;;x,,
EVTNAME800056;Rebellion in our ally!;;;;;;;;;;;;x,,,,,
EVTDESC800056;The $FROMCOUNTRY_ADJ$ government has been toppled, and the rebels blame $COUNTRY_ADJ$ influence as one of the primary causes of the old regime's corruption. We have lost our influence in $FROMCOUNTRY$ as a result, and the only question that remains is whether we wish to press our claim by force.;;;;;;;;;;;;x,,,
EVTNAME800060;The Proletariat Cause;;;;;;;;;;;;x,,,,,
EVTDESC800060;An opportunity has arisen to fund the spread of communism in a neighboring state. If discovered, this could start a diplomatic incident and gain us infamy... but if we do not act, the workers around the world will continue to slave under bourgeois oppression. The proletariats in $CAPITAL$ are calling on us to aid the cause!;;;;;;;;;;;;x,,,
EVTNAME800061;The Spread of Fascism;;;;;;;;;;;;x,,,,,
EVTDESC800061;An opportunity has arisen to fund the spread of fascism in a neighboring state. If discovered, this could start a diplomatic incident and gain us infamy... but if we do not act, we will be seen as shirking our duty to the fascist cause. The government elite in $CAPITAL$ are calling on us to aid the cause!;;;;;;;;;;;;x,,,
EVTNAME800062;The Spread of Anarcho-Liberalism;;;;;;;;;;;;x,,,,,
EVTDESC800062;An opportunity has arisen to fund the spread of anarcho-liberalism in a neighboring state. If discovered, this could start a diplomatic incident and gain us infamy... but if we do not act, we will be admitting that we cannot aid the spread of the bourgeois revolution. The liberal elite in $CAPITAL$ are calling on us to aid the cause!;;;;;;;;;;;;x,,,
EVTNAME800063;The Cause of Freedom;;;;;;;;;;;;x,,,,,
EVTDESC800063;An opportunity has arisen to fund the spread of democracy in a neighboring state. If discovered, this could start a diplomatic incident and gain us infamy... but if we do not act, we will be seen as abandoning those who live under the rule of tyrants. Liberals in $CAPITAL$ are calling on us to aid the cause of world freedom!;;;;;;;;;;;;x,,,
EVTNAME800064;We Were Discovered;;;;;;;;;;;;x,,,,,
EVTDESC800064; Several of our agents in $FROMCOUNTRY$ were discovered and interrogated, and word of our efforts have spread. This will have an impact on our infamy, and the $FROMCOUNTRY_ADJ$ may choose to take the issue as cause for war against us.;;;;;;;;;;;;x,,,
EVTNAME800065;Diplomatic Incident;;;;;;;;;;;;x,,,,,
EVTDESC800065;We have reports of $FROMCOUNTRY_ADJ$ propaganda being spread in one of our border provinces. Clearly the $FROMCOUNTRY$ government does not respect our sovereignty. Word of the event has leaked out, and members of the $COUNTRY_ADJ$ government are calling for immediate action!;;;;;;;;;;;;x,,,,
EVTNAME800066;Workers of the World;;;;;;;;;;;;x,,,,,
EVTDESC800066;If communism is to make strides in the modern era, the ruling proletariat of every nation must work together towards a common goal. Towards that end, $COUNTRY_ADJ$ leaders have called on the government to hold talks with a fellow communist nation to bring us closer together.;;;;;;;;;;;;x,,,
EVTNAME800067;$FROMCOUNTRY_ADJ$ Envoy Arrives;;;;;;;;;;;;x,,,,,
EVTDESC800067;An envoy has arrived from $FROMCOUNTRY$, offering to improve relations between our country and theirs. The $FROMCOUNTRY_ADJ$ leadership believes that nations so closely aligned in ideology should become closer in truth. Refusing their overtures could be seen as an insult.;;;;;;;;;;;;x,,,,
EVTNAME800068;Workers of the World;;;;;;;;;;;;x,,,,,
EVTDESC800068;If communism is to make strides in the modern era, the ruling proletariat of every nation must work together towards a common goal. Towards that end, $COUNTRY_ADJ$ leaders have called on the government to hold talks with a fellow communist nation to bring us closer together.;;;;;;;;;;;;x,,,
EVTNAME800069;The $COUNTRY_ADJ$ Destiny;;;;;;;;;;;;x,,,,,
EVTDESC800069;If fascism is to make strides in the modern era, the rulers of every fascist nation must work together towards a common goal. Towards that end, $COUNTRY_ADJ$ leaders have called on the government to hold talks with a fellow nation to bring us closer together.;;;;;;;;;;;;x,,,
EVTNAME800070;The $COUNTRY_ADJ$ Destiny;;;;;;;;;;;;x,,,,,
EVTDESC800070;If fascism is to make strides in the modern era, the rulers of every fascist nation must work together towards a common goal. Towards that end, $COUNTRY_ADJ$ leaders have called on the government to hold talks with a fellow nation to bring us closer together.;;;;;;;;;;;;x,,,
EVTNAME800071;The Anarcho-Liberal Agenda;;;;;;;;;;;;x,,,,,
EVTDESC800071;If anarcho-liberalism is to make strides in the modern era, the rulers of every enlightened nation must work together towards a common goal. Towards that end, $COUNTRY_ADJ$ leaders have called on the government to hold talks with a fellow anarcho-liberal nation to bring us closer together.;;;;;;;;;;;;x,,,
EVTNAME800072;The Anarcho-Liberal Agenda;;;;;;;;;;;;x,,,,,
EVTDESC800072;If anarcho-liberalism is to make strides in the modern era, the rulers of every enlightened nation must work together towards a common goal. Towards that end, $COUNTRY_ADJ$ leaders have called on the government to hold talks with a fellow anarcho-liberal nation to bring us closer together.;;;;;;;;;;;;x,,,
EVTNAME800073;The Light of Democracy;;;;;;;;;;;;x,,,,,
EVTDESC800073;The threats to the modern world are many: communism, fascism, tyranny in all forms. If the free and democratic nations of the world are to survive, they must stand together. $COUNTRY_ADJ$ leaders are calling on the government to initiate closer ties with a fellow democratic nation.;;;;;;;;;;;;x,,
EVTNAME800074;The Light of Democracy;;;;;;;;;;;;x,,,,,
EVTDESC800074;The threats to the modern world are many: communism, fascism, tyranny in all forms. If the free and democratic nations of the world are to survive, they must stand together. $COUNTRY_ADJ$ leaders are calling on the government to initiate closer ties with a fellow democratic nation.;;;;;;;;;;;;x,,
EVTNAME800075;A Communist Summit?;;;;;;;;;;;;x,,,,,
EVTDESC800075;The time has come for the great communist powers of the world to stand together. A summit has been proposed in $CAPITAL$ that would bring our nations closer, though it also has the chance of going badly and driving us further apart. Do we dare make the attempt?;;;;;;;;;;;;x,,,,
EVTNAME800076;The $FROMCOUNTRY_ADJ$ Summit;;;;;;;;;;;;x,,,,,
EVTDESC800076;An envoy has arrived from $FROMCOUNTRY$, offering to hold a summit in their capital to bring our two great powers closer together. Refusing their overtures could be seen as an insult, but it's also possible the summit could go poorly and make our relations worse rather than better.;;;;;;;;;;;;x,,,
EVTNAME800077;$COUNTRY_ADJ$-$FROMCOUNTRY_ADJ$ Summit of $YEAR$ a Success!;;;;;;;;;;;;x,,,,,
EVTDESC800077;The summit in $CAPITAL$ was a smashing success! $FROMCOUNTRY_ADJ$ diplomats left pleased with the progress, and our relations have improved significantly.;;;;;;;;;;;;x,,,,
EVTNAME800078;$COUNTRY_ADJ$-$FROMCOUNTRY_ADJ$ Summit of $YEAR$;;;;;;;;;;;;x,,,,,
EVTDESC800078;The summit in $CAPITAL$ unfortunately failed to make any significant progress. Talks with $FROMCOUNTRY$ stalled, and even with our common ideological ground there are just too many issues remaining between our nations to improve relations more than marginally.;;;;;;;;;;;;x,,,,
EVTNAME800079;$COUNTRY_ADJ$-$FROMCOUNTRY_ADJ$ Summit of $YEAR$ a Disaster!;;;;;;;;;;;;x,,,,,
EVTDESC800079;The summit in $CAPITAL$ went very poorly. There are too many issues between our nations, and $FROMCOUNTRY_ADJ$ diplomats left in a huff. Our relations have suffered as a result.;;;;;;;;;;;;x,,,,
